{
  "alignment": {
    "alignedAt": "2026-08-15T13:00:00Z",
    "receiptRef": ".mcf/receipts/intent-alignment-alignment-v1.1-canonical-001.json",
    "status": "ALIGNED"
  },
  "artifactType": "PROJECT_INTENT_PACKAGE",
  "assumptions": [],
  "blockers": [],
  "conflicts": [],
  "contentDigest": "sha256:4469d5f4d2b0f06e0a834a5cb0874e5df4f59a553e711b76040e30fa2e521371",
  "createdAt": "2026-08-15T12:00:00Z",
  "dimensions": {
    "AUTOMATION_LEVEL": {
      "provenance": [
        {
          "actor": "LEANDRO",
          "capturedAt": "2026-08-15T12:00:00Z",
          "sourceRef": "MCF-V1.1-DECISION-LEDGER-001#V11-Q15",
          "type": "PRIOR_VALID_HUMAN_DECISION"
        }
      ],
      "readinessImpact": "NON_BLOCKING",
      "state": "CLEAR",
      "value": "Delegated within envelope."
    },
    "BUSINESS_RULES": {
      "provenance": [
        {
          "actor": "LEANDRO",
          "capturedAt": "2026-08-15T12:00:00Z",
          "sourceRef": "MCF-V1.1-DECISION-LEDGER-001#V11-Q15",
          "type": "PRIOR_VALID_HUMAN_DECISION"
        }
      ],
      "readinessImpact": "NON_BLOCKING",
      "state": "CLEAR",
      "value": ["human authority remains final"]
    },
    "COST_AND_RESOURCE_CONSTRAINTS": {
      "provenance": [
        {
          "actor": "LEANDRO",
          "capturedAt": "2026-08-15T12:00:00Z",
          "sourceRef": "MCF-V1.1-IMPLEMENTATION-AUTHORIZATION-001#4",
          "type": "HUMAN_CONFIRMED_SYNTHESIS"
        }
      ],
      "readinessImpact": "NON_BLOCKING",
      "state": "CLEAR",
      "value": "No new production cost."
    },
    "CRITICAL_USER_JOURNEYS": {
      "provenance": [
        {
          "actor": "LEANDRO",
          "capturedAt": "2026-08-15T12:00:00Z",
          "sourceRef": "MCF-V1.1-DECISION-LEDGER-001#V11-Q05",
          "type": "PRIOR_VALID_HUMAN_DECISION"
        }
      ],
      "readinessImpact": "BLOCKING",
      "state": "CLEAR",
      "value": ["start", "adopt", "resume"]
    },
    "DATA_AND_SENSITIVITY": {
      "provenance": [
        {
          "actor": "LEANDRO",
          "capturedAt": "2026-08-15T12:00:00Z",
          "sourceRef": "MCF-V1.1-IMPLEMENTATION-AUTHORIZATION-001#4",
          "type": "HUMAN_CONFIRMED_SYNTHESIS"
        }
      ],
      "readinessImpact": "NON_BLOCKING",
      "state": "CLEAR",
      "value": "No new sensitive state."
    },
    "DEFINITION_OF_DONE": {
      "provenance": [
        {
          "actor": "LEANDRO",
          "capturedAt": "2026-08-15T12:00:00Z",
          "sourceRef": "MCF-V1.1-DECISION-LEDGER-001#V11-Q19",
          "type": "PRIOR_VALID_HUMAN_DECISION"
        }
      ],
      "readinessImpact": "BLOCKING",
      "state": "CLEAR",
      "value": "Qualification on an exact head."
    },
    "DESIRED_OUTCOME": {
      "provenance": [
        {
          "actor": "LEANDRO",
          "capturedAt": "2026-08-15T12:00:00Z",
          "sourceRef": "MCF-V1.1-DECISION-LEDGER-001#V11-Q18",
          "type": "PRIOR_VALID_HUMAN_DECISION"
        }
      ],
      "readinessImpact": "BLOCKING",
      "state": "CLEAR",
      "value": "A compatible v1.1 extension."
    },
    "FAILURE_TOLERANCE": {
      "provenance": [
        {
          "actor": "LEANDRO",
          "capturedAt": "2026-08-15T12:00:00Z",
          "sourceRef": "MCF-V1.1-DECISION-LEDGER-001#V11-Q04",
          "type": "PRIOR_VALID_HUMAN_DECISION"
        }
      ],
      "readinessImpact": "BLOCKING",
      "state": "CLEAR",
      "value": "Fail closed at authority boundaries."
    },
    "FUTURE_VISION": {
      "provenance": [
        {
          "actor": "LEANDRO",
          "capturedAt": "2026-08-15T12:00:00Z",
          "sourceRef": "MCF-V1.1-DECISION-LEDGER-001#V11-Q17",
          "type": "PRIOR_VALID_HUMAN_DECISION"
        }
      ],
      "readinessImpact": "NONE",
      "state": "PARTIAL",
      "value": "Transferable continuity."
    },
    "INTEGRATIONS": {
      "provenance": [
        {
          "actor": "LEANDRO",
          "capturedAt": "2026-08-15T12:00:00Z",
          "sourceRef": "MCF-V1.1-DECISION-LEDGER-001#V11-Q02",
          "type": "PRIOR_VALID_HUMAN_DECISION"
        }
      ],
      "readinessImpact": "NON_BLOCKING",
      "state": "CLEAR",
      "value": ["GitHub"]
    },
    "MOTIVATION": {
      "provenance": [
        {
          "actor": "LEANDRO",
          "capturedAt": "2026-08-15T12:00:00Z",
          "sourceRef": "MCF-V1.1-DECISION-LEDGER-001#V11-Q17",
          "type": "PRIOR_VALID_HUMAN_DECISION"
        }
      ],
      "readinessImpact": "NON_BLOCKING",
      "state": "CLEAR",
      "value": "Preserve intent across missions."
    },
    "MUST_HAVE": {
      "provenance": [
        {
          "actor": "LEANDRO",
          "capturedAt": "2026-08-15T12:00:00Z",
          "sourceRef": "MCF-V1.1-DECISION-LEDGER-001#V11-Q20",
          "type": "PRIOR_VALID_HUMAN_DECISION"
        }
      ],
      "readinessImpact": "BLOCKING",
      "state": "CLEAR",
      "value": ["PIP", "PRR"]
    },
    "NON_GOALS": {
      "provenance": [
        {
          "actor": "LEANDRO",
          "capturedAt": "2026-08-15T12:00:00Z",
          "sourceRef": "MCF-V1.1-DECISION-LEDGER-001#V11-Q18",
          "type": "PRIOR_VALID_HUMAN_DECISION"
        }
      ],
      "readinessImpact": "BLOCKING",
      "state": "CLEAR",
      "value": ["parallel runtime"]
    },
    "PLATFORM_AND_USAGE_CONTEXT": {
      "provenance": [
        {
          "actor": "LEANDRO",
          "capturedAt": "2026-08-15T12:00:00Z",
          "sourceRef": "MCF-V1.1-DECISION-LEDGER-001#V11-Q02",
          "type": "PRIOR_VALID_HUMAN_DECISION"
        }
      ],
      "readinessImpact": "NON_BLOCKING",
      "state": "CLEAR",
      "value": "Local-first repository workflow."
    },
    "PRIORITIES_AND_TRADEOFFS": {
      "provenance": [
        {
          "actor": "LEANDRO",
          "capturedAt": "2026-08-15T12:00:00Z",
          "sourceRef": "MCF-V1.1-DECISION-LEDGER-001#V11-Q18",
          "type": "PRIOR_VALID_HUMAN_DECISION"
        }
      ],
      "readinessImpact": "BLOCKING",
      "state": "CLEAR",
      "value": "Compatibility first."
    },
    "PROBLEM": {
      "provenance": [
        {
          "actor": "LEANDRO",
          "capturedAt": "2026-08-15T12:00:00Z",
          "sourceRef": "MCF-V1.1-DECISION-LEDGER-001#V11-Q20",
          "type": "PRIOR_VALID_HUMAN_DECISION"
        }
      ],
      "readinessImpact": "BLOCKING",
      "state": "CLEAR",
      "value": "Project intent needs durable continuity."
    },
    "QUALITY_EXPECTATIONS": {
      "provenance": [
        {
          "actor": "LEANDRO",
          "capturedAt": "2026-08-15T12:00:00Z",
          "sourceRef": "MCF-V1.1-DECISION-LEDGER-001#V11-Q19",
          "type": "PRIOR_VALID_HUMAN_DECISION"
        }
      ],
      "readinessImpact": "BLOCKING",
      "state": "CLEAR",
      "value": ["schema validation", "legacy regression"]
    },
    "ROLES_AND_PERMISSIONS": {
      "provenance": [
        {
          "actor": "LEANDRO",
          "capturedAt": "2026-08-15T12:00:00Z",
          "sourceRef": "MCF-V1.1-IMPLEMENTATION-AUTHORIZATION-001#6",
          "type": "HUMAN_CONFIRMED_SYNTHESIS"
        }
      ],
      "readinessImpact": "BLOCKING",
      "state": "CLEAR",
      "value": ["LEANDRO", "MESTRE", "CODEX_LOCAL"]
    },
    "SHOULD_HAVE": {
      "provenance": [
        {
          "actor": "LEANDRO",
          "capturedAt": "2026-08-15T12:00:00Z",
          "sourceRef": "MCF-V1.1-DECISION-LEDGER-001#V11-Q08",
          "type": "HUMAN_CONFIRMED_SYNTHESIS"
        }
      ],
      "readinessImpact": "NON_BLOCKING",
      "state": "CLEAR",
      "value": []
    },
    "TARGET_USERS": {
      "provenance": [
        {
          "actor": "LEANDRO",
          "capturedAt": "2026-08-15T12:00:00Z",
          "sourceRef": "MCF-V1.1-DECISION-LEDGER-001#V11-Q08",
          "type": "HUMAN_CONFIRMED_SYNTHESIS"
        }
      ],
      "readinessImpact": "BLOCKING",
      "state": "CLEAR",
      "value": ["MCF operators"]
    }
  },
  "humanDecisions": [
    {
      "decisionId": "V11-Q20",
      "provenance": [
        {
          "actor": "LEANDRO",
          "capturedAt": "2026-08-15T12:00:00Z",
          "sourceRef": "MCF-V1.1-DECISION-LEDGER-001#V11-Q20",
          "type": "HUMAN_DIRECT_STATEMENT"
        }
      ],
      "statement": "Extend v1.0 without parallel architecture.",
      "status": "CURRENT"
    }
  ],
  "identity": {
    "projectName": "Multiagent Collaboration Framework",
    "repository": "leon337/multiagent-collaboration-framework"
  },
  "lifecycle": "ALIGNED",
  "methodologyPin": {
    "immutableRef": "git:5dc055cb7d402e5774b40b82723a8f008cd00e80",
    "version": "1.1.0"
  },
  "originalIntent": {
    "provenance": [
      {
        "actor": "LEANDRO",
        "capturedAt": "2026-08-15T12:00:00Z",
        "sourceRef": "MCF-V1.1-DECISION-LEDGER-001#V11-Q20",
        "type": "HUMAN_DIRECT_STATEMENT"
      }
    ],
    "text": "Extend MCF v1.0 compatibly with durable project-intent continuity."
  },
  "projectId": "multiagent-collaboration-framework",
  "readiness": {
    "assessedAt": "2026-08-15T12:00:00Z",
    "blockingUnknownIds": [],
    "state": "READY_FOR_ALIGNMENT"
  },
  "revisionId": "v1.1-canonical-001",
  "schemaVersion": "1.0",
  "technicalDelegations": [],
  "unknowns": []
}
